{"schema_version":"1.0.0","source":{"url":"https://stripe.com","captured_at":"2026-05-21T11:46:59.896Z","backend":"designlang","backend_version":"12.14.0"},"capture":{"full":false,"dark":false,"responsive":false,"interactions":false,"screenshots":false,"authenticated":false},"artifacts":[{"path":"website/public/gallery/stripe-com/stripe-com-DESIGN.md","category":"brand","format":"md","size_bytes":3968,"storage":"external","external_uri":"github://Manavarya09/design-extract/website/public/gallery/stripe-com/stripe-com-DESIGN.md@cfee6055909b6bd84c1b9fae4ff20dc4dd0d74bf","source_blob_sha":"cfee6055909b6bd84c1b9fae4ff20dc4dd0d74bf"}],"provenance":{"adapter":"extraction-engine/import-existing-external","raw_output_dir":"external://github/Manavarya09/design-extract/website/public/gallery/stripe-com","source_repo":"Manavarya09/design-extract","source_ref":"main","source_blob_sha":"cfee6055909b6bd84c1b9fae4ff20dc4dd0d74bf","import_mode":"official_gallery_partial"},"quality":{"complete":false,"doctor_passed":false,"fallback_used":false,"exit_code":null,"notes":["Official Designlang gallery artifact imported by reference.","Historical snapshot: live revalidation pending.","Partial evidence only; capture flags are not inferred from missing gallery files."]}}
