{"schema_version":"1.0.0","source":{"url":"https://vercel.com","captured_at":"2026-05-21T11:46:57.594Z","backend":"designlang","backend_version":"12.14.0"},"capture":{"full":false,"dark":false,"responsive":false,"interactions":false,"screenshots":false,"authenticated":false},"artifacts":[{"path":"website/public/gallery/vercel-com/vercel-com-DESIGN.md","category":"brand","format":"md","size_bytes":3968,"storage":"external","external_uri":"github://Manavarya09/design-extract/website/public/gallery/vercel-com/vercel-com-DESIGN.md@f23f560b495c00dd8728179fc80c7a43f993e821","source_blob_sha":"f23f560b495c00dd8728179fc80c7a43f993e821"}],"provenance":{"adapter":"extraction-engine/import-existing-external","raw_output_dir":"external://github/Manavarya09/design-extract/website/public/gallery/vercel-com","source_repo":"Manavarya09/design-extract","source_ref":"main","source_blob_sha":"f23f560b495c00dd8728179fc80c7a43f993e821","import_mode":"official_gallery_partial"},"quality":{"complete":false,"doctor_passed":false,"fallback_used":false,"exit_code":null,"notes":["Official Designlang gallery artifact imported by reference.","Historical snapshot: live revalidation pending.","Partial evidence only; capture flags are not inferred from missing gallery files."]}}
